{
  "$schema": "http://json-schema.org/draft-07/schema#",
  "title": "Profile Configuration",
  "type": "object",
  "required": ["id", "name", "description", "provider", "tokenSaving"],
  "properties": {
    "id": {
      "type": "string",
      "minLength": 1
    },
    "name": {
      "type": "string",
      "minLength": 1
    },
    "description": {
      "type": "string",
      "minLength": 1
    },
    "provider": {
      "type": "string",
      "enum": ["openai", "anthropic", "ollama", "auto", "google", "deepseek", "xai", "mistral"]
    },
    "model": {
      "type": "string",
      "minLength": 1
    },
    "maxTokens": {
      "type": "number",
      "exclusiveMinimum": 0
    },
    "temperature": {
      "type": "number",
      "minimum": 0,
      "maximum": 2
    },
    "apiKeyEnv": {
      "type": ["string", "array", "null"]
    },
    "endpoint": {
      "type": "string"
    },
    "routing": {
      "type": "object",
      "properties": {
        "simple": { "type": "object" },
        "complex": { "type": "object" }
      }
    },
    "tokenSaving": {
      "type": "object",
      "required": ["contextTruncation", "maxContextMessages"],
      "properties": {
        "contextTruncation": {
          "type": "boolean"
        },
        "maxContextMessages": {
          "type": "number",
          "exclusiveMinimum": 0
        },
        "aggressiveSummarization": {
          "type": "boolean"
        },
        "skipSystemPromptRepetition": {
          "type": "boolean"
        }
      }
    }
  }
}
