{
  "id": "o3",
  "name": "O3 — Deep Reasoning",
  "description": "OpenAI O3. Specialized for complex reasoning, math, and multi-step problem solving.",
  "provider": "openai",
  "model": "o3",
  "maxTokens": 16384,
  "temperature": 0.1,
  "apiKeyEnv": "OPENAI_API_KEY",
  "tokenSaving": {
    "contextTruncation": true,
    "maxContextMessages": 8
  }
}
