{
  "id": "codex-5.3",
  "name": "Codex 5.3 — Full Power",
  "description": "OpenAI Codex latest version. Maximum coding capability.",
  "provider": "openai",
  "model": "codex-5.3",
  "maxTokens": 8192,
  "temperature": 0.2,
  "apiKeyEnv": "OPENAI_API_KEY",
  "tokenSaving": {
    "contextTruncation": true,
    "maxContextMessages": 20
  }
}
